"Title","Release.Year","Locations","Fun.Facts","Production.Company","Distributor","Director","Writer","Actor.1","Actor.2","Actor.3","lon","lat"
"The Dead Pool",1988,"San Francisco Drydock (The Dogpatch)","","Warner Bros. Pictures","Warner Bros. Pictures","Buddy Van Horn","Harry Julian Fink","Clint Eastwood","Liam Neeson","Patricia Clarkson",-122.3866097,37.760628
"Sweet November",2001,"Citicorp Center (1 Sansome Street at Sutter)","","Warner Bros. Pictures","Warner Bros. Pictures","Pat O'Connor","Paul Yurick","Keanu Reeves","Charlize Theron","",-122.4011537,37.7904462
"Woman on the Run",1950,"835-865 Market Street at 5th Street","The Emporium, a department store, stood in this location. Bloomingdale's is now located here.","Fidelity Pictures Corporation","Universal Pictures","Norman Foster","Norman Foster","Ann Sheridan","Dennis O'Keefe","Robert Keith",-122.4068622,37.7835179
"Ballers Season 3",2017,"San Remo Hotel (2237 Mason)","","Chori Perros Productions, LLC","HBO","Julian Farino","Stephen Levinson","Dwayne Johnson","John David Washington","Omar Benson Miller",-122.413603,37.8042943
"When We Rise",2017,"Buena Vista Park","","Film 49 Productions","Amercian Broadcasting Company","Gus Van Sant","Dustin Lance Black","Guy Pierce","Mary-Louise Parker","Michael Kenneth Williams",-122.4414145,37.7684046
"Always Be My Maybe",2019,"Heart of the City Farmers Market at UN Plaza","","Isla Productions, LLC","Netflix","Nahnatchka Khan","Michael Golamco, Randall Park, Ali Wong","Ali Wong","Randall Park","Keanu Reeves",-122.4149619,37.7798199
"Pacific Heights",1990,"Texas & 19th Streets (Potrero Hill)","","Morgan Creek Productions","Twentieth Century Fox Film Corporation","John Schlesinger","Daniel Pyne","Melanie Griffith","Matthew Modine","",-99.9018131,31.9685988
"Jagged Edge",1985,"Golden Gate Bridge","With 23 miles of ladders and 300,000 rivets in each tower, the Golden Gate Bridge was the world's longest span when it opened in 1937.","Columbia Pictures Corp.","Columbia Pictures","Richard Marquand","Joe Eszterhas","Glenn Close","Jeff Bridges","Peter Coyote",-122.4782551,37.8199286
"Always Be My Maybe",2019,"717 Grant Ave","","Isla Productions, LLC","Netflix","Nahnatchka Khan","Michael Golamco, Randall Park, Ali Wong","Ali Wong","Randall Park","Keanu Reeves",-122.4063975,37.7936544
"Chance- Season 1 ep102",2016,"Betelnut restaurant, 2030 Union St.","","TVM Productions","HULU","Lenny Abrahamson","Alexandra Cunningham","Hugh Laurie","Gretchen Mol","Ethan Suplee",-122.4327432,37.7976263
"Sense8 - Season 2",2016,"Filbert between Hyde and Jones","","Unpronounceable Productions, LLC","Netflix","Wachowski Siblings","J. Michael Straczynski, Wachowiski Siblings","Jamie Clayton","Daryl Hannah","Naveen Andrews",-122.4238833,37.7995352
"Innerspace",1987,"Telegraph Hill","Largely untouched by the 1906 earthquake, Telegraph Hill has the most pre-1870 buildings in the city.","Amblin Entertainment","Warner Bros. Pictures","Joe Dante","Chip Proser","Dennis Quaid","Martin Short","Meg Ryan",-122.4056674,37.8013407
"Getting Even with Dad",1994,"War Memorial Building (401 Van Ness Avenue)","","Metro-Goldwyn-Mayer (MGM)","Metro-Goldwyn-Mayer (MGM)","Howard Deutch","Tom S. Parker","Macaulay Culkin","Ted Danson","",-122.42101,37.7795732
"Looking",2014,"Orphan Andy's","","Mission Street Productions, LLC","Home Box Office (HBO)","Andrew Haigh","Michael Lannan","Jonathan Groff","Frankie J. Alvarez","Murray Bartlett",-122.4349009,37.7624063
"Dirty Harry",1971,"Forest Hill Station- MUNI","","The Malpaso Company","Warner Brothers","Don Siegel","Harry Julian Fink","Clint Eastwood","Harry Guardino","",-122.4590076,37.7479845
"Sudden Impact",1983,"The Embarcadero/Ferry Building","Every hour and half-hour, the clock bell atop the Ferry Building chimes portions of the Westminster Quarters.","Warner Bros. Pictures","Warner Bros. Pictures","Clint Eastwood","Harry Julian Fink","Clint Eastwood","Sondra Locke","Pat Hingle",-122.3933208,37.7955703
"Looking",2014,"Fort Funston","","Mission Street Productions, LLC","Home Box Office (HBO)","Andrew Haigh","Michael Lannan","Jonathan Groff","Frankie J. Alvarez","Murray Bartlett",-122.5028052,37.7195436
"Sudden Fear",1952,"Brocklebank Apartments (1000 Mason Street)","","Joseph Kaufmann Pictures","RKO Pictures","David Miller","Lenore J. Coffee","Joan Crawford","Jack Palance","Gloria Grahame",-122.4105791,37.7931691
"Bullitt",1968,"1153-57 Taylor Street","Embarcadero Freeway, which was featured in the film was demolished in 1989 because of structural damage from the 1989 Loma Prieta Earthquake)","Warner Brothers / Seven Arts
Seven Arts","Warner Brothers","Peter Yates","Alan R. Trustman","Steve McQueen","Jacqueline Bisset","Robert Vaughn",-122.413026,37.793298
"Godzilla",2014,"Broadway & Columbus","","Nautilus Productions, LLC","Warner Bros. Pictures","Gareth Edwards","Max Borenstein","Aaron Taylor-Johnson","Elizabeth Olsen","Bryan Cranston",-95.982443,36.1510606
"Foul Play",1978,"Potrero Hill Bathhouse & Feed Co. (199 Mississippi Street)","","Paramount Pictures","Paramount Pictures","Colin Higgins","Colin Higgins","Goldie Hawn","Chevy Chase","Burgess Meredith",-122.3944936,37.7641057
"Tales of the City",2019,"Hotel Jefferson, 440 Eddy St","","Universal Television LLC","Netflix","Alan Poul, Silas Howard, Stacie Passon","Armistead Maupin, Lauren Morelli, Hansol Jung, Marcus Gardley","Laura Linney","Ellen Page","Murray Bartlett",-122.4149487,37.7837743
"House of Sand and Fog",2003,"","","DreamWorks SKG","DreamWorks Distribution","Vadim Perelman","Vadim Perelman","Jennifer Connelly","Ben Kingsley","",-122.4194155,37.7749295
"Magnum Force",1973,"18th Street Overpass (Potrero Hill)","","The Malpaso Company","Warner Bros. Pictures","Ted Post","John Milius","Clint Eastwood","Hal Holbrook","Mitchell Ryan",-122.3972334,37.7625493
"When a Man Loves a Woman",1994,"Buena Vista Café (2765 Hyde Street)","","Touchstone Pictures","Buena Vista Pictures","Luis Mandoki","Ronald Bass","Andy Garcia","Meg Ryan","",-122.4207783,37.8065045
"Venom",2018,"Grant Ave btwn Washington and Jackson","","L.O.Z. Productions, Inc.","Columbia Pictures, Sony Pictures Releasing","Ruben Fleischer","Jeff Pinkner, Scott Rosenberg","Tom Hardy","Michelle Wiliams","Riz Ahmed",-122.4069697,37.7974831
"I Am Michael",2015,"Sanchez/Cumberland steps and sidewalks","","That’s Hollywood","","Justin Kelly","Justin Kelly","James Franco","Emma Roberts","Zachary Quinto",-122.4304289,37.7593199
"The Dead Pool",1988,"Hall of Justice (850 Bryant Street)","","Warner Bros. Pictures","Warner Bros. Pictures","Buddy Van Horn","Harry Julian Fink","Clint Eastwood","Liam Neeson","Patricia Clarkson",-122.4040001,37.775146
"Junior",1994,"722 Steiner Street","","Northern Lights Entertainment","Universal Pictures","Ivan Reitman","Kevin Wade","Arnold Schwarzenegger","Danny DeVito","Emma Thompson",-122.4327961,37.7764653
"Blue Jasmine",2013,"Pacific & Divisadero","","Perdido Productions","Sony Pictures Classics","Woody Allen","Woody Allen","Cate Blanchett","Alec Baldwin","Peter Sarsgaard",-124.508523,-8.783195
"Looking Season 2 ep 203",2015,"Mad Dog Bar, 530 Haight Street","The character of Doris was originally a recurring role, but everyone on the team liked Lauren Weedman's performance so much that she became a full time regular during the second season.","Mission Street Productions, LLC","HBO","Andrew Haigh","Michael Lannan","Jonathan Groff","Frankie Alvarez","Murray Bartlett",-122.431029,37.7721618
"Bedazzled",2000,"Montgomery & Market Streets","","Twentieth Century Fox Film Corp.","Twentieth Century Fox Film Corp.","Harold Ramis","Harold Ramis","Brendan Fraser","Elizabeth Hurley","",-86.3077368,32.3792233
"The Dead Pool",1988,"McAllister & Scott Streets (Hayes Valley)","","Warner Bros. Pictures","Warner Bros. Pictures","Buddy Van Horn","Harry Julian Fink","Clint Eastwood","Liam Neeson","Patricia Clarkson",-95.9584059,36.0458566
"Around the Fire",1998,"Ocean Beach","On Jan. 25, 1878, the King Philip ship crashed in Ocean Beach. Occasionally, the ship's wreckage may be found on the beach-- most recently it was seen in 2007.","Paradigm Studio","Ardustry Home Entertainment","John Jacobsen","John Comerford","Tara Reid","","",-122.510734,37.7593921
"Maxie",1985,"Grace Cathedral Episcopal Church (1100 California Street)","Grace Cathedral Episcopal Church is the West Coast's largest Episcopalian cathedral.","Elsboy Entertainment","Orion Pictures Corporation","Paul Aaron","Patricia Resnick","Glenn Close","Mandy Patinkin","Ruth Gordon",-122.4130261,37.7919185
"Patty Hearst",1988,"Bank of America (38th Street at Balboa Street)","The Bank of America Building was the tallest building on the West Coast from 1969-1972, when it was surpassed by the TransAmerica Pyramid. Today, the Bank of America building is the 5th tallest building on the West Coast.","Atlantic Entertainment Group","Atlantic Releasing Corporation","Paul Schrader","Nicholas Kazan","Natasha Richardson","William Forsythe","Ving Rhames",-122.4985965,37.7754416
"Chance- Season 1 ep104",2016,"Bayview Police Station, 201 Williams Ave.","","TVM Productions","HULU","Carl Franklin","Peter Elkoff","Hugh Laurie","Gretchen Mol","Ethan Suplee",-122.3977161,37.7298279
"Chance Season 2",2017,"Waller St between Masonic and Del Mar St","","TVM Productions Inc.","Hulu","Rozann Dawson","Alexandra Cunningham","Hugh Laurie","Greta Lee","Ethan Suplee",-122.4449082,37.7702074
"A Taiwanese Tale of Two Cities",2018,"700 Block of Grant Ave.","","Envision Productions Inc.","Netflix","Tien-Lun Yeh","Ling-Hui Chen, Nancy Chen, Chih-Chi Fan, Chia-Hui Lin","Tammy Cheng","Peggy Tseng","Shen-Hao Wen",-122.4060168,37.793493
"Murder in the First, Season 2",2015,"1400 16th Street","","Turner North Center Productions","Turner Network Television (TNT)","Steven Bochcho","Eric Lodal","Taye Diggs","Kathleen Robertson","Ian Anthony Dale",-122.4013308,37.7668643
"Ant-Man",2015,"420 Jones St. at Ellis St.","","PYM Particles Productions, LLC","Walt Disney Studios Motion Pictures","Peyton Reed","Gabriel Ferrari","Michael Douglas","Paul Rudd","",-122.412723,37.7852042
"Star Trek IV: The Voyage Home",1986,"Golden Gate Park","","Paramount Pictures","Paramount Pictures","Leonard Nimoy","Steve Meerson","William Shatner","Leonard Nimoy","George Takei",-122.4862138,37.7694208
"Red Widow",2013,"York & 24th St.","","Beyond Pix","American Broadcasting Company (ABC)","Alon Aranya","Melissa Rosenberg","Radha Mitchell","Sterling Beaumon","Clifton Collins Jr.",-1.0872979,53.9599651
"Down Periscope",1996,"","","Twentieth Century Fox Film Corp.","Twentieth Century Fox Film Corp.","David S. Ward","Hugh Wilson","Kelsey Grammar","Lauren Holly","",-122.4194155,37.7749295
"Always Be My Maybe",2019,"Fairmont Hotel - Penthouse Suite","Keanu Reeves' penthouse suite scenes were filmed at San Francisco's Fairmont Hotel.","Isla Productions, LLC","Netflix","Nahnatchka Khan","Michael Golamco, Randall Park, Ali Wong","Ali Wong","Randall Park","Keanu Reeves",-122.4104443,37.7923897
"Magnum Force",1973,"Golden Gate Bridge","With 23 miles of ladders and 300,000 rivets in each tower, the Golden Gate Bridge was the world's longest span when it opened in 1937.","The Malpaso Company","Warner Bros. Pictures","Ted Post","John Milius","Clint Eastwood","Hal Holbrook","Mitchell Ryan",-122.4782551,37.8199286
"Etruscan Smile",2017,"St Regis Hotel, 125 3rd Street","","Po Valley Productions, LLC","TBD","Oded Binnun/ Michel Brezis","Sarah Bellwood, Michal Lali Kagan, Michael McGowan Amital Stern, Jose Luis Sampedro","Brian Cox","Roseanne Arquette","Thora Birch",-122.4014681,37.7861299
"Murder in the First, Season 1",2014,"Cameron House (920 Sacramento Street)","","Turner North Center Productions","Turner Network Television (TNT)","Steven Bochcho","Eric Lodal","Taye Diggs","Kathleen Robertson","Ian Anthony Dale",-122.4084188,37.7932786
"Sphere",1998,"S.S. Jeremiah O'Brien","","Constant c Productions","Warner brothers Pictures","Barry Levinson","Kurt Wimmer","Dustin Hoffman","Sharon Stone","",-122.4181442,37.8110638
"The Dead Pool",1988,"One Thousand Powell Apartments (1000 Powell Street)","","Warner Bros. Pictures","Warner Bros. Pictures","Buddy Van Horn","Harry Julian Fink","Clint Eastwood","Liam Neeson","Patricia Clarkson",-122.4094054,37.7940447
"Americana",2015,"Romolo Place @ Fresno St.","","Sutro Films LLC","","Zachary Shedd","Zachary Shedd","Kelli Garner","Jack Davenport","Peter Coyote",-122.4063965,37.7986013
"A Taiwanese Tale of Two Cities",2018,"Civic Center Plaza","","Envision Productions Inc.","Netflix","Tien-Lun Yeh","Ling-Hui Chen, Nancy Chen, Chih-Chi Fan, Chia-Hui Lin","Tammy Cheng","Peggy Tseng","Shen-Hao Wen",-122.4177047,37.7794744
"Big Eyes",2014,"Filbert St. & Leavenworth","","Blink & Wink Productions","Weinstein Company","Tim Burton","Scott Alexander","Amy Adams","Krysten Ritter","Christoph Waltz",-122.4238833,37.7995352
"Fearless",1993,"5th and Beale Streets","","Spring Creek Productions","Warner Bros. Pictures","Peter Weir","Rafael Yglesias","Jeff Bridges","Isabella Rosellini","Rosie Perez",-122.3963791,37.7913165
"Ant-Man and the Wasp",2018,"Missouri St at 18th St","VFX Plate Shots, chase scene","PYM Particles Productions II, LLC","Walt Disney Studios Motion Pictures","Peyton Reed","Chris McKenna","Paul Rudd","Evangeline Lilly","Michael Douglas",-122.3965523,37.762585
"Dirty Harry",1971,"St. Peter & Paul's Church (666 Filbert Street, Washington Square)","Though Marilyn Monroe and Joe DiMaggio were not allowed to be married at the Church (DiMaggio had married his first wife at the Church but was divorced), the couple returned to the steps of the Church for photos, following their City Hall nuptials.","The Malpaso Company","Warner Brothers","Don Siegel","Harry Julian Fink","Clint Eastwood","Harry Guardino","",-87.8466472,42.6173425
"Tales of the City",2019,"766 Vallejo St","","Universal Television LLC","Netflix","Alan Poul, Silas Howard, Stacie Passon","Armistead Maupin, Lauren Morelli, Hansol Jung, Marcus Gardley","Laura Linney","Ellen Page","Murray Bartlett",-122.4099596,37.7987186
"Etruscan Smile",2017,"Jones @ Broadway","","Po Valley Productions, LLC","TBD","Oded Binnun/ Michel Brezis","Sarah Bellwood, Michal Lali Kagan, Michael McGowan Amital Stern, Jose Luis Sampedro","Brian Cox","Roseanne Arquette","Thora Birch",-122.4152099,37.7968072
"Sudden Impact",1983,"Civic Center Plaza","","Warner Bros. Pictures","Warner Bros. Pictures","Clint Eastwood","Harry Julian Fink","Clint Eastwood","Sondra Locke","Pat Hingle",-122.4177047,37.7794744
"Twisted",2004,"","","Paramount Pictures","Paramount Pictures","Philip Kaufman","Sarah Thorp","Ashley Judd","Samuel L. Jackson","",-122.4194155,37.7749295
"Looking",2014,"St. Francis Fountain","","Mission Street Productions, LLC","Home Box Office (HBO)","Andrew Haigh","Michael Lannan","Jonathan Groff","Frankie J. Alvarez","Murray Bartlett",-122.4083301,37.7526903
"Smile Again, Jenny Lee",2015,"Huntington Park (California & Taylor Streets, Nob Hill)","","Carlo Caldana/Marguery Films","","Carlo Caldana","Linda Demetrick","Craig Tsuyumine","Puneet Prasad","Larry Kitagawa",-118.2250725,33.9816812
"The Birds",1963,"Powell and Geary Streets (Union Square)","The pet shop featured in the film does not exist, but was based on the now-closed Robison's House of Pets formerly located on Maiden Lane.","Universal Pictures","Universal Pictures","Alfred Hitchcock","Evan Hunter","Tippi Hedren","Suzanne Pleshette","Rod Taylor",-122.4075935,37.7879797
"Etruscan Smile",2017,"Broadway @ Jones Streets","","Po Valley Productions, LLC","TBD","Oded Binnun/ Michel Brezis","Sarah Bellwood, Michal Lali Kagan, Michael McGowan Amital Stern, Jose Luis Sampedro","Brian Cox","Roseanne Arquette","Thora Birch",-122.4146993,37.7942592
"Greed",1924,"Bush and Sutter Streets","","Metro-Goldwyn-Mayer (MGM)","Metro-Goldwyn-Mayer (MGM)","Eric von Stroheim","Eric von Stroheim","Zasu Pitts","Gibson Gowland","Jean Hersholt",-122.4031247,37.7907846
"Fearless",1993,"Bank of America Building (555 California Street)","The Bank of America Building was the tallest building on the West Coast from 1969-1972, when it was surpassed by the TransAmerica Pyramid. Today, the Bank of America building is the 5th tallest building on the West Coast.","Spring Creek Productions","Warner Bros. Pictures","Peter Weir","Rafael Yglesias","Jeff Bridges","Isabella Rosellini","Rosie Perez",-122.4037148,37.792062
"Magnum Force",1973,"Hall of Justice (850 Bryant Street)","","The Malpaso Company","Warner Bros. Pictures","Ted Post","John Milius","Clint Eastwood","Hal Holbrook","Mitchell Ryan",-122.4040001,37.775146
"Blue Jasmine",2013,"SFO International Airport Terminal 3","","Perdido Productions","Sony Pictures Classics","Woody Allen","Woody Allen","Cate Blanchett","Alec Baldwin","Peter Sarsgaard",-122.3874941,37.61993
"Smile Again, Jenny Lee",2015,"Mason & Sacramento St","","Carlo Caldana/Marguery Films","","Carlo Caldana","Linda Demetrick","Craig Tsuyumine","Puneet Prasad","Larry Kitagawa",-84.309939,39.3600586
"Budding Prospects, Pilot",2017,"1641 York Street","","Picrow Streaming Inc.","Amazon","Terry Zwigoff","Melissa Axelrod, T. C. Boyle (based on the book by)","Adam Rose","Will Sasso","Joel David Moore",-122.4062631,37.7473312
"Doctor Dolittle",1998,"Coit Tower","The Tower was funded by a gift bequeathed by Lillie Hitchcock Coit, a socialite who reportedly liked to chase fires. Though the tower resembles a firehose nozzle, it was not designed this way.","Twentieth Century Fox Film Cooperation","Twentieth Century Fox Film Cooperation","Betty Thomas","Nat Mauldin","Eddie Murphy","Ossie Davis","",-122.4058222,37.8023949
"Looking Season 2 ep 209",2015,"68 Division Street","","Mission Street Productions, LLC","HBO","Andrew Haigh","Michael Lannan","Jonathan Groff","Frankie Alvarez","Murray Bartlett",-122.4026916,37.7700948
"The Last Black Man in San Francisco",2019,"Hotel Metropolis, 25 Mason St","","LBMISF, LLC","A43","Joe Talbot","Joe Talbot, Jimmie Fails, Rob Richert","Jimmie Fails","Jonathan Majors","Danny Glover",-122.409495,37.7834757
"Boys and Girls",2000,"Golden Gate Bridge","With 23 miles of ladders and 300,000 rivets in each tower, the Golden Gate Bridge was the world's longest span when it opened in 1937.","Punch 21 Productions","Dimension Films","Robert Iscove","The Drews","Freddie Prinze, Jr.","Alyson Hannigan","",-122.4782551,37.8199286
"Time After Time",1979,"California Academy of Sciences (Golden Gate Park)","Founded in 1853, 3 years after California joined the United States, the Academy was originally named the California Academy of Natural Sciences and was the first institution of its kind in the United States.","Orion Pictures Corp.","Columbia Broadcasting System (CBS)","Nicholas Meyer","Karl Alexander","Malcolm McDowell","Mary Steenburgen","David Warner",-122.4660947,37.7698646
"It Came From Beneath the Sea",1955,"Chrissy Field","With 23 miles of ladders and 300,000 rivets in each tower, the Golden Gate Bridge was the world's longest span when it opened in 1937.","Clover Productions","Columbia Pictures","Robert Gordon","George Worthing Yates","Kenneth Tobey","Faith Domergue","Donald Curtis",-122.4650165,37.8040257
"Looking",2014,"BART from Civic Center to 24th St.","","Mission Street Productions, LLC","Home Box Office (HBO)","Andrew Haigh","Michael Lannan","Jonathan Groff","Frankie J. Alvarez","Murray Bartlett",NA,NA
"Nine Months",1995,"Belli Building (722 Montgomery Street at Washington)","","1492 Pictures","Twentieth Century Fox Film Corp.","Chris Columbus","Chris Columbus","Hugh Grant","Julianne Moore","Robin Williams",-122.4031027,37.7961117
"The Pursuit of Happyness",2006,"Glide Memorial Church (434 Ellis St)","","Columbia Pictures Corporation","Columbia Pictures","Steven Conrad","Gabriele Muccino","Will Smith","Jayden C. Smith","",-122.4114072,37.785154
"Godzilla",2014,"Kearney & Pine St.","","Nautilus Productions, LLC","Warner Bros. Pictures","Gareth Edwards","Max Borenstein","Aaron Taylor-Johnson","Elizabeth Olsen","Bryan Cranston",-99.0816784,40.6993303
"Hulk",2003,"Telegraph Hill","Largely untouched by the 1906 earthquake, Telegraph Hill has the most pre-1870 buildings in the city.","Universal Pictures","Universal Pictures","Ang Lee","Stan Lee","Eric Bana","Jennifer Connelly","",-122.4056674,37.8013407
"The Presidio",1988,"Golden Gate Bridge","With 23 miles of ladders and 300,000 rivets in each tower, the Golden Gate Bridge was the world's longest span when it opened in 1937.","Paramount Pictures","Paramount Pictures","Peter Hyams","Larry Ferguson","Sean Connery","Mark Harmon","Meg Ryan",-122.4782551,37.8199286
"When We Rise",2017,"Castro St. between 17th and 18th St.","","Film 49 Productions","Amercian Broadcasting Company","Gus Van Sant","Dustin Lance Black","Guy Pierce","Mary-Louise Parker","Michael Kenneth Williams",-122.435291,37.7609603
"Ant-Man",2015,"Treasure Island, Building #1, Ave of the Palms","Aerial and exterior shots","PYM Particles Productions, LLC","Walt Disney Studios Motion Pictures","Peyton Reed","Gabriel Ferrari","Michael Douglas","Paul Rudd","",-122.3707037,37.8172181
"The Last Black Man in San Francisco",2019,"Haight and Belvedere","","LBMISF, LLC","A52","Joe Talbot","Joe Talbot, Jimmie Fails, Rob Richert","Jimmie Fails","Jonathan Majors","Danny Glover",-122.4496773,37.7696712
"When We Rise",2017,"Bay Bridge","","Film 49 Productions","Amercian Broadcasting Company","Gus Van Sant","Dustin Lance Black","Guy Pierce","Mary-Louise Parker","Michael Kenneth Williams",-122.3778182,37.7982799
"Time After Time",1979,"Intersection of California & Grant Streets (Richmond District)","","Orion Pictures Corp.","Columbia Broadcasting System (CBS)","Nicholas Meyer","Karl Alexander","Malcolm McDowell","Mary Steenburgen","David Warner",-122.141318,37.477971
"Murder in the First, Season 1",2014,"Waverly Alley between Grant and Sacramento Streets","","Turner North Center Productions","Turner Network Television (TNT)","Steven Bochcho","Eric Lodal","Taye Diggs","Kathleen Robertson","Ian Anthony Dale",-122.4064031,37.7934259
"Petulia",1968,"Cala Foods (California Street and Hyde)","","Warner Brothers / Seven Arts","Warner Brothers / Seven Arts","Richard Lester","Lawrence B. Marcus","Julie Christie","George C. Scott","Richard Chamberlain",-122.4177829,37.7907129
"Woman on the Run",1950,"819 Mason Street at Pine","","Fidelity Pictures Corporation","Universal Pictures","Norman Foster","Norman Foster","Ann Sheridan","Dennis O'Keefe","Robert Keith",-122.41091,37.791162
"Shattered",1991,"","","Capella International","Metro-Goldwyn-Mayer","Wolfgang Petersen","Wolfgang Petersen","Tom Berenger","Bob Hoskins","",-122.4194155,37.7749295
"Greed",1924,"Hayes Street at Laguna","","Metro-Goldwyn-Mayer (MGM)","Metro-Goldwyn-Mayer (MGM)","Eric von Stroheim","Eric von Stroheim","Zasu Pitts","Gibson Gowland","Jean Hersholt",-122.4262854,37.7764699
"Vertigo",1958,"900 Lombard Street","Lombard Street is not actually the most crooked in SF. That honor goes to Potrero Hill's Vermont Street between 22nd and 23rd.","Alfred J. Hitchcock Productions","Paramount Pictures","Alfred Hitchcock","Alec Coppel","James Stewart","Kim Novak","Barbara Bel Geddes",-122.4165931,37.8025517
"Chance - Season 1 Pilot",2016,"Harvey Milk Rec Center, 50 Scott St.","","TVM Productions","HULU","Lenny Abrahamson","Alexandra Cunningham and Kem Nunn","Hugh Laurie","Gretchen Mol","Ethan Suplee",-122.4347583,37.7696027
"Terminator - Genisys",2015,"Front St. between Market and Clay","","T5 Productions LLC","Paramount Pictures","Alan Taylor","James Cameron","Arnold Schwarzenegger","Jason Clarke","",-122.3981194,37.7920406
"Looking",2014,"2866 24th St.","","Mission Street Productions, LLC","Home Box Office (HBO)","Andrew Haigh","Michael Lannan","Jonathan Groff","Frankie J. Alvarez","Murray Bartlett",-122.4097206,37.7529677
"The Rock",1996,"Palace of Fine Arts (3301 Lyon Street)","The original Palace was built for the 1915 Panama-Pacific Exposition, and completely destroyed in 1964. It was rebuilt in 1965.","Hollywood Pictures","Buena Vista Pictures","Michael Bay","David Weisberg","Sean Connery","Nicolas Cage","",-122.4486055,37.8020068
"The Diary of a Teenage Girl",2015,"Yerba Buena Island","","Diary the Movie, LLC","Sony Pictures Classics","Marielle Heller","Marielle Heller","Alexander Skarsgard","Kristen Wiig","Christopher Meloni",-122.3668348,37.8108709
"The Wedding Planner",2001,"Grace Cathedral Episcopal Church (1100 California Street)","Grace Cathedral Episcopal Church is the West Coast's largest Episcopalian cathedral.","Columbia Pictures","Sony Pictures Entertainment","Adam Shankman","Pamela Falk","Jennifer Lopez","Matthew McConaughey","",-122.4130261,37.7919185
"Thief of Hearts",1984,"","","Paramount Pictures","Paramount Pictures","Douglas Day Stewart","Douglas Day Stewart","Steven Bauer","David Caruso","Barbara Williams",-122.4194155,37.7749295
"Magnum Force",1973,"2190 Washington Street (Pacific Heights)","","The Malpaso Company","Warner Bros. Pictures","Ted Post","John Milius","Clint Eastwood","Hal Holbrook","Mitchell Ryan",-122.4291618,37.7925895
"The Conversation",1974,"Saks Fifth Avenue (384 Post Street, Union Square)","","American Zoetrope","Paramount Pictures","Francis Ford Coppola","Francis Ford Coppola","Gene Hackman","John Cazale","Allen Garfield",-122.4081582,37.7885778
"The Conversation",1974,"Alcoa Building (1 Maritime Plaza)","A partially-above ground parking structure near the building made it necessary for architects to make the Alcoa Building's diagonal bracing visible, instead of placing it inside and drastically reducing the amount usable interior space.","American Zoetrope","Paramount Pictures","Francis Ford Coppola","Francis Ford Coppola","Gene Hackman","John Cazale","Allen Garfield",-122.3992066,37.7956599
"Looking Season 2 ep 206",2015,"770 Haight Street","","Mission Street Productions, LLC","HBO","Andrew Haigh","Michael Lannan","Jonathan Groff","Frankie Alvarez","Murray Bartlett",-122.43489,37.771831
