"Title","Release.Year","Locations","Fun.Facts","Production.Company","Distributor","Director","Writer","Actor.1","Actor.2","Actor.3","lon","lat"
"Murder in the First, Season 1",2014,"24th Street between Folsom and Harrison Streets","","Turner North Center Productions","Turner Network Television (TNT)","Steven Bochcho","Eric Lodal","Taye Diggs","Kathleen Robertson","Ian Anthony Dale",-122.414191,37.7522638
"Looking Season 2 ep 204",2015,"534 Hyde Street","","Mission Street Productions, LLC","HBO","Andrew Haigh","Michael Lannan","Jonathan Groff","Frankie Alvarez","Murray Bartlett",-122.4161084,37.7859698
"Chance- Season 1 ep109",2016,"Ocean Park Motel","","TVM Productions","HULU","Sara Gran and Pete Begler","Dan Attias","Hugh Laurie","Gretchen Mol","Ethan Suplee",-122.5038779,37.7363439
"Birth of the Dragon",2016,"California at Grant","","BOTD U.S. Productions, Inc.","Kylin Pictures","George Nolfi ","Christopher Wilkinson, Stephen J. Rivele","Philip Ng","Billy Magnussen","Yu Xia",-122.405954,37.7924638
"Pushing Dead",2016,"Turk Street between Steiner and Scott Streets","","Pushing Dead , LLC","TBD","Tom Brown","Tom Brown","Danny Glover","James Roday","Robin Weigert",-122.4239413,37.7815527
"Murder in the First, Season 3",2016,"2633 Vallejo Street","","Turner North Center Productions","Turner Network Television (TNT)","Steven Bochcho","Eric Lodal","Taye Diggs","Kathleen Robertson","Ian Anthony Dale",-122.4406711,37.7943953
"Chance- Season 1 ep103",2016,"60 Leavenworth St.","","TVM Productions","HULU","Michael Lehmann","Kem Nunn","Hugh Laurie","Gretchen Mol","Ethan Suplee",-122.4135524,37.7811707
"GirlBoss",2017,"Filbert and Kearny Steps","","Hippolyta Productions, LLC","Netflix","Jamie Babbit, Amanda Brotchie, Steven K. Tsuchida, Christian Ditter, John Riggi","Kay Cannon","Britt Robertson","Ellie Reed","Amanda Rea",-122.4062706,37.8017787
"Chance - Season 1 Pilot",2016,"Mario's Café, 566 Columbus","","TVM Productions","HULU","Lenny Abrahamson","Alexandra Cunningham and Kem Nunn","Hugh Laurie","Gretchen Mol","Ethan Suplee",-122.4097803,37.8002499
"Murder in the First, Season 1",2014,"350 Union Street","","Turner North Center Productions","Turner Network Television (TNT)","Steven Bochcho","Eric Lodal","Taye Diggs","Kathleen Robertson","Ian Anthony Dale",-122.4053724,37.8010964
"Chance- Season 1 ep103",2016,"Laguna Honda Hospital","","TVM Productions","HULU","Michael Lehmann","Kem Nunn","Hugh Laurie","Gretchen Mol","Ethan Suplee",-122.456924,37.7489202
"Looking ""Special""",2016,"Encore Karaoke, 1550 California Street","","Mission Street Productions, LLC","HBO","Andrew Haigh","Michael Lannan","Jonathan Groff","Frankie Alvarez","Murray Bartlett",-122.4200466,37.7907946
"Sense8 - Season 2",2016,"Clay between Stockton and Grant","","Unpronounceable Productions, LLC","Netflix","Wachowski Siblings","J. Michael Straczynski, Wachowiski Siblings","Jamie Clayton","Daryl Hannah","Naveen Andrews",-122.4069697,37.7974831
"Looking Season 2 ep 205",2015,"160 Church Street","","Mission Street Productions, LLC","HBO","Andrew Haigh","Michael Lannan","Jonathan Groff","Frankie Alvarez","Murray Bartlett",-122.4294287,37.7683721
"Murder in the First, Season 3",2016,"500 Grove Street","","Turner North Center Productions","Turner Network Television (TNT)","Steven Bochcho","Eric Lodal","Taye Diggs","Kathleen Robertson","Ian Anthony Dale",-122.4250694,37.7777521
"Chance- Season 1 ep107",2016,"1958 Valencia St.","","TVM Productions","HULU","Alexandra Cunningham and Kem Nunn","Michael Lehmann","Hugh Laurie","Gretchen Mol","Ethan Suplee",-122.4201447,37.7464681
"Pushing Dead",2016,"Church Street MUNI Station","","Pushing Dead , LLC","TBD","Tom Brown","Tom Brown","Danny Glover","James Roday","Robin Weigert",-122.4297042,37.7694834
"Looking Season 2 ep 209",2015,"SF Zoo, 2945 Sloat Blvd","","Mission Street Productions, LLC","HBO","Andrew Haigh","Michael Lannan","Jonathan Groff","Frankie Alvarez","Murray Bartlett",-122.5043292,37.7333055
"Looking Season 2 ep 210",2015,"Willy's Barber shop, 3227 22nd Street","","Mission Street Productions, LLC","HBO","Andrew Haigh","Michael Lannan","Jonathan Groff","Frankie Alvarez","Murray Bartlett",-122.419437,37.7552116
"When We Rise",2017,"Harvey Milk Plaza, 17th and Castro","","Film 49 Productions","Amercian Broadcasting Company","Gus Van Sant","Dustin Lance Black","Guy Pierce","Mary-Louise Parker","Michael Kenneth Williams",-122.4367222,37.759088
"GirlBoss",2017,"Clarion Alley between Valencia and Mission","The murals that make up this famous alley were first painted in 1992 and still looked after by the Clarion Alley Mural Project.","Hippolyta Productions, LLC","Netflix","Jamie Babbit, Amanda Brotchie, Steven K. Tsuchida, Christian Ditter, John Riggi","Kay Cannon","Britt Robertson","Ellie Reed","Amanda Rea",-122.4207943,37.7629824
"Etruscan Smile",2017,"Andronico's, 1200 Irving Street","","Po Valley Productions, LLC","TBD","Oded Binnun/ Michel Brezis","Sarah Bellwood, Michal Lali Kagan, Michael McGowan Amital Stern, Jose Luis Sampedro","Brian Cox","Roseanne Arquette","Thora Birch",-122.4711468,37.7641474
"Etruscan Smile",2017,"Castle Street @ Green Street","","Po Valley Productions, LLC","TBD","Oded Binnun/ Michel Brezis","Sarah Bellwood, Michal Lali Kagan, Michael McGowan Amital Stern, Jose Luis Sampedro","Brian Cox","Roseanne Arquette","Thora Birch",-122.4050755,37.8000109
"Looking ""Special""",2016,"Philz Coffee, 1258 Minnesota Street","","Mission Street Productions, LLC","HBO","Andrew Haigh","Michael Lannan","Jonathan Groff","Frankie Alvarez","Murray Bartlett",-122.3900774,37.7543341
"Chance- Season 1 ep104",2016,"1018 Tennessee St.","","TVM Productions","HULU","Carl Franklin","Peter Elkoff","Hugh Laurie","Gretchen Mol","Ethan Suplee",-122.389657,37.758936
"Pushing Dead",2016,"5th Ave @ Fulton Street in Golden Gate Park","","Pushing Dead , LLC","TBD","Tom Brown","Tom Brown","Danny Glover","James Roday","Robin Weigert",-122.4862138,37.7694208
"Chance- Season 1 ep110",2016,"Ocean Park Motel","","TVM Productions","HULU","Alexandra Cunningham and Kem Nunn","Michael Lehmann","Hugh Laurie","Gretchen Mol","Ethan Suplee",-122.5038779,37.7363439
"Chance- Season 1 ep106",2016,"Montgomery between Pacific and Broadway","","TVM Productions","HULU","Sara Gran","Dan Attias","Hugh Laurie","Gretchen Mol","Ethan Suplee",-122.4034351,37.7944107
"GirlBoss",2017,"Clayton Post Office, 554 Clayton St.","","Hippolyta Productions, LLC","Netflix","Jamie Babbit, Amanda Brotchie, Steven K. Tsuchida, Christian Ditter, John Riggi","Kay Cannon","Britt Robertson","Ellie Reed","Amanda Rea",-122.4484007,37.7700546
"Murder in the First, Season 2",2015,"Potrero Hill Recreation Center (801 Arkansas Street)","","Turner North Center Productions","Turner Network Television (TNT)","Steven Bochcho","Eric Lodal","Taye Diggs","Kathleen Robertson","Ian Anthony Dale",-122.3972493,37.7561624
"Chance - Season 1 ep105",2016,"The Drew School, 2901 California","","TVM Productions","HULU","Victoria Morrow","Roxann Dawson","Hugh Laurie","Gretchen Mol","Ethan Suplee",-122.442352,37.787638
"Chance- Season 1 ep104",2016,"Palace of Fine Arts","The Palace of Fine Arts was designed by Bernard Maybeck and was originally constructed for the 1915 Panama-Pacific Exposition.  It has been in films such as Time After Time, The Room, Twisted, So I Married An Axe Murderer and The Rock.","TVM Productions","HULU","Carl Franklin","Peter Elkoff","Hugh Laurie","Gretchen Mol","Ethan Suplee",-122.4486055,37.8020068
"Looking ""Special""",2016,"3079 16th Street","","Mission Street Productions, LLC","HBO","Andrew Haigh","Michael Lannan","Jonathan Groff","Frankie Alvarez","Murray Bartlett",-122.4213253,37.7648256
"Chance- Season 1 ep102",2016,"Heron and Berwick Alleys","","TVM Productions","HULU","Lenny Abrahamson","Alexandra Cunningham ","Hugh Laurie","Gretchen Mol","Ethan Suplee",-122.408348,37.7747933
"When We Rise",2017,"Twin Peaks Bar, 401 Castro","","Film 49 Productions","Amercian Broadcasting Company","Gus Van Sant","Dustin Lance Black","Guy Pierce","Mary-Louise Parker","Michael Kenneth Williams",-122.4349646,37.7624034
"GirlBoss",2017,"La Taqueria, 2889 Mission St.","The restaurant was given the honor of ""America's Best Burrito"" in 2014 by ESPN's FiveThirtyEight. ","Hippolyta Productions, LLC","Netflix","Jamie Babbit, Amanda Brotchie, Steven K. Tsuchida, Christian Ditter, John Riggi","Kay Cannon","Britt Robertson","Ellie Reed","Amanda Rea",-122.4180867,37.7508961
"Chance- Season 1 ep102",2016,"Mason and Pacific","","TVM Productions","HULU","Lenny Abrahamson","Alexandra Cunningham ","Hugh Laurie","Gretchen Mol","Ethan Suplee",-122.4115851,37.7962333
"Budding Prospects, Pilot",2017,"951 Hudson Avenue","","Picrow Streaming Inc.","Amazon ","Terry Zwigoff","Melissa Axelrod, T. C. Boyle (based on the book by)","Adam Rose","Will Sasso","Joel David Moore",-122.376629,37.7331614
"Murder in the First, Season 2",2015,"83 Watchman Way","","Turner North Center Productions","Turner Network Television (TNT)","Steven Bochcho","Eric Lodal","Taye Diggs","Kathleen Robertson","Ian Anthony Dale",-122.3950942,37.7550507
"Pushing Dead",2016,"Hayes Street between Ashbury and Shrader","","Pushing Dead , LLC","TBD","Tom Brown","Tom Brown","Danny Glover","James Roday","Robin Weigert",-122.4348106,37.7753881
"Looking ""Special""",2016,"17th & Market Street","","Mission Street Productions, LLC","HBO","Andrew Haigh","Michael Lannan","Jonathan Groff","Frankie Alvarez","Murray Bartlett",-90.2995785,40.9583003
"Murder in the First, Season 1",2014,"Kearny Street between Broadway and Pacific Avenue","","Turner North Center Productions","Turner Network Television (TNT)","Steven Bochcho","Eric Lodal","Taye Diggs","Kathleen Robertson","Ian Anthony Dale",-122.405267,37.797331
"When We Rise",2017,"Castro Theatre, 429 Castro St.","","Film 49 Productions","Amercian Broadcasting Company","Gus Van Sant","Dustin Lance Black","Guy Pierce","Mary-Louise Parker","Michael Kenneth Williams",-122.4347591,37.7620333
"Looking Season 2 ep 210",2015,"BART Station @ 16th Street & Mission Streets","","Mission Street Productions, LLC","HBO","Andrew Haigh","Michael Lannan","Jonathan Groff","Frankie Alvarez","Murray Bartlett",-122.4195684,37.7653618
"Looking ""Special""",2016,"Grant Avenue between Sacramento and Washington","","Mission Street Productions, LLC","HBO","Andrew Haigh","Michael Lannan","Jonathan Groff","Frankie Alvarez","Murray Bartlett",-122.4069697,37.7974831
"Pushing Dead",2016,"Matching Half Café, 1799 McAllister Street","","Pushing Dead , LLC","TBD","Tom Brown","Tom Brown","Danny Glover","James Roday","Robin Weigert",-122.4414933,37.7773006
"Looking Season 2 ep 204",2015,"Daniel's Pharmacy, 943 Geneva Ave.","","Mission Street Productions, LLC","HBO","Andrew Haigh","Michael Lannan","Jonathan Groff","Frankie Alvarez","Murray Bartlett",-122.4403456,37.7163218
"GirlBoss",2017,"Filbert between Leavenworth and Hyde","","Hippolyta Productions, LLC","Netflix","Jamie Babbit, Amanda Brotchie, Steven K. Tsuchida, Christian Ditter, John Riggi","Kay Cannon","Britt Robertson","Ellie Reed","Amanda Rea",-122.4191684,37.8000576
"Etruscan Smile",2017,"Chaya / Perry's 132 Embarcadero","","Po Valley Productions, LLC","TBD","Oded Binnun/ Michel Brezis","Sarah Bellwood, Michal Lali Kagan, Michael McGowan Amital Stern, Jose Luis Sampedro","Brian Cox","Roseanne Arquette","Thora Birch",-122.392181,37.7930864
"Sense8 - Season 2",2016,"Grant between Sacramento and Jack Kerouac Alley","","Unpronounceable Productions, LLC","Netflix","Wachowski Siblings","J. Michael Straczynski, Wachowiski Siblings","Jamie Clayton","Daryl Hannah","Naveen Andrews",-121.4943996,38.5815719
"GirlBoss",2017,"Fillmore between Haight and Waller","","Hippolyta Productions, LLC","Netflix","Jamie Babbit, Amanda Brotchie, Steven K. Tsuchida, Christian Ditter, John Riggi","Kay Cannon","Britt Robertson","Ellie Reed","Amanda Rea",-122.4336699,37.7879587
"Murder in the First, Season 1",2014,"50 California Street","","Turner North Center Productions","Turner Network Television (TNT)","Steven Bochcho","Eric Lodal","Taye Diggs","Kathleen Robertson","Ian Anthony Dale",-122.3973037,37.7940487
"Murder in the First, Season 3",2016,"Linden Alley between Octavia and Gough Streets","","Turner North Center Productions","Turner Network Television (TNT)","Steven Bochcho","Eric Lodal","Taye Diggs","Kathleen Robertson","Ian Anthony Dale",-122.4251853,37.7876068
"Nine Months",1995,"Star's Café (55 Golden Gate Avenue at Van Ness)","","1492 Pictures","Twentieth Century Fox Film Corp.","Chris Columbus","Chris Columbus","Hugh Grant","Julianne Moore","Robin Williams",-122.4112732,37.7821176
"Superman",1978,"Golden Gate Bridge","With 23 miles of ladders and 300,000 rivets in each tower, the Golden Gate Bridge was the world's longest span when it opened in 1937.","Dovemead Films","Warner Bros. Pictures","Richard Donner","Jerry Siegel","Christopher Reeve","Gene Hackman","Marlon Brando",-122.4782551,37.8199286
"Time After Time",1979,"One Embarcadero Center (Financial District)","","Orion Pictures Corp.","Columbia Broadcasting System (CBS)","Nicholas Meyer","Karl Alexander","Malcolm McDowell","Mary Steenburgen","David Warner",-122.3998262,37.7946507
"Bullitt",1968,"Cesar Chavez & Mission Street (Mission)","","Warner Brothers / Seven Arts
Seven Arts","Warner Brothers","Peter Yates","Alan R. Trustman","Steve McQueen","Jacqueline Bisset","Robert Vaughn",-97.5014224,35.4276176
"The Game",1997,"Mason & California Streets (Nob Hill)","","Polygram Filmed Entertainment","Polygram Filmed Entertainment","David Fincher","John Brancato","Michael Douglas","Sean Penn","Deborah Kara Unger",-84.309939,39.3600586
"The Game",1997,"Sheraton Palace Hotel (639 Market Street)","The hotel was destroyed in the 1906 earthquake and fire, had to be rebuilt, and was reopened in 1909. ","Polygram Filmed Entertainment","Polygram Filmed Entertainment","David Fincher","John Brancato","Michael Douglas","Sean Penn","Deborah Kara Unger",-122.401799,37.7881067
"Nine to Five",1980,"Albert S. Samuels Clock (856 Market Street between Powell and Stockton)","","Twentieth Century Fox Film Corporation","Twentieth Century Fox Film Corporation","Colin Higgins","Colin Higgins","Jane Fonda","Lily Tomlin","Dolly Parton",-122.4069149,37.7850278
"Herbie Rides Again",1974,"Castagnola's Restaurant (Fisherman's Wharf)","","Walt Disney Productions","Buena Vista Distribution","Robert Stevenson","Bill Walsh","Helen Hayes","Ken Berry","Stefanie Powers",-122.417549,37.8081971
"Edtv",1999,"20th & Connecticut Streets (Potrero Hill)","","Imagine Entertainment","MCA / Universal Pictures","Ron Howard","Lowell Ganz","Matthew McConaughey","Jenna Elfman","",-84.432859,39.150966
"Memoirs of an Invisible Man",1992,"St. Elizabeth Apartment House (901 Powell Street at Sacramento)","","Warner Bros. Pictures","Warner Bros. Pictures","John Carpenter","Robert Collector","Chevy Chase","Daryl Hannah","Sam Neill",-122.4095704,37.7930902
"The Organization",1971,"","","The Mirisch Corporation","United Artists","Don Medford","James R. Webb","Sidney Poitier","Barbara McNair","",-122.4194155,37.7749295
"The Caine Mutiny",1954,"Golden Gate Bridge","With 23 miles of ladders and 300,000 rivets in each tower, the Golden Gate Bridge was the world's longest span when it opened in 1937.","Stanley Kramer Productions","Columbia Pictures","Edward Dmytryk","Stanley Roberts","Humphrey Bogart","Fred MacMurray","Jose Ferrer",-122.4782551,37.8199286
"Interview With The Vampire",1994,"Golden Gate Bridge","With 23 miles of ladders and 300,000 rivets in each tower, the Golden Gate Bridge was the world's longest span when it opened in 1937.","Geffen Pictures","Geffen Pictures","Neil Jordan","Anne Rice","Brad Pitt","Christian Slater","Tom Cruise",-122.4782551,37.8199286
"Pal Joey",1957,"Coit Tower","The Tower was funded by a gift bequeathed by Lillie Hitchcock Coit, a socialite who reportedly liked to chase fires. Though the tower resembles a firehose nozzle, it was not designed this way.","Columbia Pictures Corporation","Columbia Pictures","George Sidney","Dorothy Kingsley","Rita Hayworth","Frank Sinatra","Kim Novak",-122.4058222,37.8023949
"Invasion of the Body Snatchers",1978,"Ramada Plaza Hotel Downtown (1231 Market Street, Civic Center)","","Solofilm","United Artists","Philip Kaufman","Jack Finney","Donald Sutherland","Jeff Goldblum","Brooke Adams",-122.4151108,37.7781664
"The Net",1995,"Moscone Convention Center","","Columbia Pictures Corp.","Columbia Pictures","Irwin Winkler","John Brancato","Sandra Bullock","Jeremy Northam","",-122.40069,37.7843234
"Cherish",2002,"387 Fair Oaks at 25th Street","","3 Ring Circus Films","Fine Line Features","Finn Taylor","Finn Taylor","Brad Hunt","Robin Tunney","",-122.4236094,37.7506147
"Invasion of the Body Snatchers",1978,"United Nations Plaza (Civic Center)","United Nations Plaza was built in 1975 and across its walkways are white lines into which the preamble to the preamble of the UN charter is carved.","Solofilm","United Artists","Philip Kaufman","Jack Finney","Donald Sutherland","Jeff Goldblum","Brooke Adams",-122.4137147,37.7795744
"D.O.A",1950,"Union Square","During the Civil War, pro-Union rallies were held in the Square, and thus the area was called ""Union Square"". ","Cardinal Pictures","United Artists","Rudolph Mate","Russell Rouse","Edmond O'Brien","Pamela Britton","Luther Adler",-122.4075935,37.7879797
"Mission (aka City of Bars)",2001,"The 500 Club (500 Guerrero Street, Mission District)","",NA,NA,"Loren Marsh","Loren Marsh","Chris Coburn","","",-122.4241468,37.7630418
"The Graduate",1967,"San Francisco Zoo (2701 Sloat Blvd.)","","Embassy Pictures Corporation","Embassy Pictures Corporation","Mike Nichols","Calder Willingham","Anne Bancroft","Dustin Hoffman","Katharine Ross",-122.5043292,37.7333055
"Freebie and the Bean",1974,"Stockton Tunnel (Stockton Street at Sutter Street)","Opened in 1914, the Stockton Tunnel was built to provide North Beach residents access to the thriving downtown area.","Warner Bros. Pictures","American Broadcasting Company (ABC)","Richard Rush","Robert Kaufman","Alan Arkin","James Caan","Loretta Swit",-122.4076696,37.7927728
"The Right Stuff",1983,"City Hall","The dome of SF's City Hall is almost a foot taller than that of the US Capitol Building. In 1954, Joe DiMaggio and Marilyn Monroe married at the Beaux Arts-style building.","The Ladd Company","The Ladd Company","Philip Kaufman","Philip Kaufman","Sam Shepard","Scott Glenn","Ed Harris",-122.4192646,37.7792597
"The Enforcer",1976,"Balmy Street (Mission District)","","Warner Bros. Pictures","Warner Bros. Pictures","James Fargo","Stirling Silliphant","Clint Eastwood","Tyne Daly","Harry Guardino",-122.4124058,37.7517298
"Tin Cup",1996,"","","Regency Enterprises","Warner Bros. Pictures","Ron Shelton","John Norville","Kevin Costner","Rene Russo","",-122.4194155,37.7749295
"Never Die Twice",2001,"Postcard Row (Alamo Square, Hayes Valley)","The 6 Victorian homes across from Alamo Square Park are among the few Victorians to survive the Great Fire.","Scott / Kelly Films","","Sean A.F. Scott","Sean A.F. Scott & Nancy L. Kelly","Claudia Christian","","",-122.432758,37.7762593
"Alcatraz",2012,"Filbert St. from Jones to Mason","","Bonanza Productions Inc.","Warner Bros. Television","J.J. Abrams","Steven Lilien","Sarah Jones","Jorge Garcia","",-122.4125873,37.8008786
"The Dead Pool",1988,"San Francisco Drydock (The Dogpatch)","","Warner Bros. Pictures","Warner Bros. Pictures","Buddy Van Horn","Harry Julian Fink","Clint Eastwood","Liam Neeson","Patricia Clarkson",-122.3866097,37.760628
"Jagged Edge",1985,"Golden Gate Bridge","With 23 miles of ladders and 300,000 rivets in each tower, the Golden Gate Bridge was the world's longest span when it opened in 1937.","Columbia Pictures Corp.","Columbia Pictures","Richard Marquand","Joe Eszterhas","Glenn Close","Jeff Bridges","Peter Coyote",-122.4782551,37.8199286
"Innerspace",1987,"Telegraph Hill","Largely untouched by the 1906 earthquake, Telegraph Hill has the most pre-1870 buildings in the city.","Amblin Entertainment","Warner Bros. Pictures","Joe Dante","Chip Proser","Dennis Quaid","Martin Short","Meg Ryan",-122.4056674,37.8013407
"Dirty Harry",1971,"Forest Hill Station- MUNI","","The Malpaso Company","Warner Brothers","Don Siegel","Harry Julian Fink","Clint Eastwood","Harry Guardino","",-122.4590076,37.7479845
"Sudden Impact",1983,"The Embarcadero/Ferry Building","Every hour and half-hour, the clock bell atop the Ferry Building chimes portions of the Westminster Quarters.","Warner Bros. Pictures","Warner Bros. Pictures","Clint Eastwood","Harry Julian Fink","Clint Eastwood","Sondra Locke","Pat Hingle",-122.3933208,37.7955703
"Sudden Fear",1952,"Brocklebank Apartments (1000 Mason Street)","","Joseph Kaufmann Pictures","RKO Pictures","David Miller","Lenore J. Coffee","Joan Crawford","Jack Palance","Gloria Grahame",-122.4105791,37.7931691
"Bullitt",1968,"SF General Hospital Center (1001 Potrero Avenue, Potrero Hill)","SF General Hospital is the only Level I Trauma Center serving San Francisco and northern San Mateo County. ","Warner Brothers / Seven Arts
Seven Arts","Warner Brothers","Peter Yates","Alan R. Trustman","Steve McQueen","Jacqueline Bisset","Robert Vaughn",-122.4049965,37.7561161
"Bullitt",1968,"1153-57 Taylor Street","Embarcadero Freeway, which was featured in the film was demolished in 1989 because of structural damage from the 1989 Loma Prieta Earthquake)","Warner Brothers / Seven Arts
Seven Arts","Warner Brothers","Peter Yates","Alan R. Trustman","Steve McQueen","Jacqueline Bisset","Robert Vaughn",-122.413026,37.793298
"Foul Play",1978,"Potrero Hill Bathhouse & Feed Co. (199 Mississippi Street)","","Paramount Pictures","Paramount Pictures","Colin Higgins","Colin Higgins","Goldie Hawn","Chevy Chase","Burgess Meredith",-122.3944936,37.7641057
"Magnum Force",1973,"18th Street Overpass (Potrero Hill)","","The Malpaso Company","Warner Bros. Pictures","Ted Post","John Milius","Clint Eastwood","Hal Holbrook","Mitchell Ryan",-122.3972334,37.7625493
"The Dead Pool",1988,"Hall of Justice (850 Bryant Street)","","Warner Bros. Pictures","Warner Bros. Pictures","Buddy Van Horn","Harry Julian Fink","Clint Eastwood","Liam Neeson","Patricia Clarkson",-122.4040001,37.775146
"Junior",1994,"722 Steiner Street","","Northern Lights Entertainment","Universal Pictures","Ivan Reitman","Kevin Wade","Arnold Schwarzenegger","Danny DeVito","Emma Thompson",-122.4327961,37.7764653
"Freebie and the Bean",1974,"Nob Hill","Railroad tycoons like Leland Stanford (founder of Stanford University) lived in Nob Hill at the turn of the 20th Century. The 1906 earthquake completely destroyed Nob Hill, with the exception of the wall that surrounded the mansions of Stanford and his neighbor Mark Hopkins. ","Warner Bros. Pictures","American Broadcasting Company (ABC)","Richard Rush","Robert Kaufman","Alan Arkin","James Caan","Loretta Swit",-122.416113,37.793014
"The Dead Pool",1988,"McAllister & Scott Streets (Hayes Valley)","","Warner Bros. Pictures","Warner Bros. Pictures","Buddy Van Horn","Harry Julian Fink","Clint Eastwood","Liam Neeson","Patricia Clarkson",-95.9584059,36.0458566
"Maxie",1985,"Grace Cathedral Episcopal Church (1100 California Street)","Grace Cathedral Episcopal Church is the West Coast's largest Episcopalian cathedral.","Elsboy Entertainment","Orion Pictures Corporation","Paul Aaron","Patricia Resnick","Glenn Close","Mandy Patinkin","Ruth Gordon",-122.4130261,37.7919185
"Patty Hearst",1988,"Bank of America (38th Street at Balboa Street)","The Bank of America Building was the tallest building on the West Coast from 1969-1972, when it was surpassed by the TransAmerica Pyramid. Today, the Bank of America building is the 5th tallest building on the West Coast.","Atlantic Entertainment Group","Atlantic Releasing Corporation","Paul Schrader","Nicholas Kazan","Natasha Richardson","William Forsythe","Ving Rhames",-122.4985965,37.7754416
"Sense8 - Season 2",2016,"San Francisco City Hall, 1 Dr. Carlton B. Goodlett Pl.","Many films have shot scene in and around the building including Raiders of the Lost Ark, Invasion of the Body Snatchers, Dirty Harry, The Towering Inferno, A View to a Kill and most recently, Milk. The Christmas party scene for this show was shot in the Rotunda. ","Unpronounceable Productions, LLC","Netflix","Wachowski Siblings","J. Michael Straczynski, Wachowiski Siblings","Jamie Clayton","Daryl Hannah","Naveen Andrews",-122.4192646,37.7792597
"Star Trek IV: The Voyage Home",1986,"Golden Gate Park","","Paramount Pictures","Paramount Pictures","Leonard Nimoy","Steve Meerson","William Shatner","Leonard Nimoy","George Takei",-122.4862138,37.7694208
"Down Periscope",1996,"","","Twentieth Century Fox Film Corp.","Twentieth Century Fox Film Corp.","David S. Ward","Hugh Wilson","Kelsey Grammar","Lauren Holly","",-122.4194155,37.7749295
"Magnum Force",1973,"Golden Gate Bridge","With 23 miles of ladders and 300,000 rivets in each tower, the Golden Gate Bridge was the world's longest span when it opened in 1937.","The Malpaso Company","Warner Bros. Pictures","Ted Post","John Milius","Clint Eastwood","Hal Holbrook","Mitchell Ryan",-122.4782551,37.8199286
"Hard to Hold",1984,"Fairmont Hotel (950 Mason Street, Nob Hill)","In 1945 the Fairmont hosted the United Nations Conference on International Organization as delegates arrived to draft a charter for the organization. The U.S. Secretary of State, Edward Stettinius drafted the charter in the hotel's Garden Room.","Universal Pictures","Universal Pictures","Larry Peerce","Thomas Hedley, Jr. ","Rick Springfield","","",-122.4104443,37.7923897
"Sphere",1998,"S.S. Jeremiah O'Brien","","Constant c Productions","Warner brothers Pictures","Barry Levinson","Kurt Wimmer","Dustin Hoffman","Sharon Stone","",-122.4181442,37.8110638
