"Title","Release.Year","Locations","Fun.Facts","Production.Company","Distributor","Director","Writer","Actor.1","Actor.2","Actor.3","lon","lat"
"Beautiful Boy",2018,"Haight at Masonic","","Big Indie Pictures","Amazon Studios","Felix van Groeningen","Luke Davies","Steve Carell","Timothee Chalamet","Maura Tierney",-122.4453661,37.7702198
"Pushing Dead",2016,"Ele Nino Traiing Cetner, 2920 3rd Street","","Pushing Dead , LLC","TBD","Tom Brown","Tom Brown","Danny Glover","James Roday","Robin Weigert",-122.3879659,37.7522031
"Edtv",1999,"Mario's Bohemian Cigar Store (Washington Square)","","Imagine Entertainment","MCA / Universal Pictures","Ron Howard","Lowell Ganz","Matthew McConaughey","Jenna Elfman","",-122.4097803,37.8002499
"A Taiwanese Tale of Two Cities",2018,"Steiner St at Fulton St","","Envision Productions Inc.","Netflix","Tien-Lun Yeh","Ling-Hui Chen, Nancy Chen, Chih-Chi Fan, Chia-Hui Lin","Tammy Cheng","Peggy Tseng","Shen-Hao Wen",-122.4332489,37.7775046
"180",2011,"Epic Roasthouse (399 Embarcadero)","","SPI Cinemas","","Jayendra","Umarji Anuradha, Jayendra, Aarthi Sriram, & Suba","Siddarth","Nithya Menon","Priya Anand",-122.3890417,37.7904926
"Parks and Recreation",2014,"Filbert from Hyde to Leavenworth","","NBC Universal Media, LLC","NBC Universal Media, LLC","Dean Holland","Greg Daniels","Amy Poehler","","",-122.4191684,37.8000576
"Woman on the Run",1950,"Former Hall of Justice (750 Kearny Street at Washington)","","Fidelity Pictures Corporation","Universal Pictures","Norman Foster","Norman Foster","Ann Sheridan","Dennis O'Keefe","Robert Keith",-122.4042951,37.7951479
"Summertime",2015,"Duboce Park","","Creative Monster Productions, Inc.","13 Distribution","Gabriele Muccino","Gabriele Muccino","Jessica Rothe","Scott Bakula","Matilda Anna Ingrid Lutz",-122.433214,37.769551
"Looking",2014,"The Café at 2369 Market St.","","Mission Street Productions, LLC","Home Box Office (HBO)","Andrew Haigh","Michael Lannan","Jonathan Groff","Frankie J. Alvarez","Murray Bartlett",-122.4343334,37.7629417
"Swingin' Along",1961,"Powell Street","","Twentieth Century Fox Film Corporation","Twentieth Century Fox Film Corporation","Charles Barton","Jameson Brewer","Tommy Noonan","Barbara Eden","Peter Marshall",-122.4100932,37.796504
"Dirty Harry",1971,"Washington Square, North Beach","","The Malpaso Company","Warner Brothers","Don Siegel","Harry Julian Fink","Clint Eastwood","Harry Guardino","",-122.41,37.8008333
"Venom",2018,"O'Farrell between Leavenworth and Jones","","L.O.Z. Productions, Inc.","Columbia Pictures, Sony Pictures Releasing","Ruben Fleischer","Jeff Pinkner, Scott Rosenberg","Tom Hardy","Michelle Wiliams","Riz Ahmed",-122.4145275,37.7854504
"Forrest Gump",1994,"Palace of Fine Arts (3301 Lyon Street)","The original Palace was built for the 1915 Panama-Pacific Exposition, and completely destroyed in 1964. It was rebuilt in 1965.","Paramount Pictures","Paramount Pictures","Robert Zemeckis","Eric Roth","Tom Hanks","Robin Wright","",-122.4486055,37.8020068
"Boys and Girls",2000,"City Hall","The dome of SF's City Hall is almost a foot taller than that of the US Capitol Building. In 1954, Joe DiMaggio and Marilyn Monroe married at the Beaux Arts-style building.","Punch 21 Productions","Dimension Films","Robert Iscove","The Drews","Freddie Prinze, Jr.","Alyson Hannigan","",-122.4192646,37.7792597
"Joy Luck Club",1993,"180 Manchester Street","","Hollywood Pictures","National Broadcasting Company (NBC)","Wayne Wang","Amy Tan","Kieu Chinh","Tsai Chin","France Nuyen",-122.4143291,37.7442046
"The Dead Pool",1988,"The Cannery (281 Leavenworth Street, Fisherman's Wharf)","","Warner Bros. Pictures","Warner Bros. Pictures","Buddy Van Horn","Harry Julian Fink","Clint Eastwood","Liam Neeson","Patricia Clarkson",-122.419463,37.807258
"Sister Act 2: Back in the Habit",1993,"St. Peter & Paul's Church (666 Filbert Street, Washington Square)","Though Marilyn Monroe and Joe DiMaggio were not allowed to be married at the Church (DiMaggio had married his first wife at the Church but was divorced), the couple returned to the steps of the Church for photos, following their City Hall nuptials.","Touchstone Pictures","Buena Vista Pictures","Bill Duke","Joseph Howard","Whoopi Goldberg","Maggie Smith","",-87.8466472,42.6173425
"Steve Jobs",2015,"Castro St. between 21st an Hill St","","RDF Productions LLC","Universal Pictures","Danny Boyle","Aaron Sorkin","Michael Fassbender","Kate Winslet","Seth Rogen",-122.434465,37.755955
"Murder in the First, Season 3",2016,"Civic Center Plaza","","Turner North Center Productions","Turner Network Television (TNT)","Steven Bochcho","Eric Lodal","Taye Diggs","Kathleen Robertson","Ian Anthony Dale",-122.4177047,37.7794744
"Point Blank",1967,"Alcatraz Island","Alcatraz Island was a military fort before it became a prison.","Metro-Goldwyn Mayer","Metro-Goldwyn Mayer","John Boorman","Alexander Jacobs","Lee Marvin","Angie Dickinson","Keenan Wynn",-122.4229555,37.8269775
"Big Eyes",2014,"Palace of Fine Arts","","Blink & Wink Productions","Weinstein Company","Tim Burton","Scott Alexander","Amy Adams","Krysten Ritter","Christoph Waltz",-122.4486055,37.8020068
"Patch Adams",1998,"Treasure Island","An artificial island, Treasure Island was created for the 1939 Golden Gate International Exposition, and is named after the novel by Robert Louis Stevenson, a one-time San Francisco resident.","Bungalow 78 Productions","Universal Pictures","Tom Shadyac","Steve Oedekerk","Robin Williams","Philip Seymour Hoffman","",-122.370648,37.8235515
"Bullitt",1968,"Bayshore Blvd near Cesar Chavez (Bayview)","","Warner Brothers / Seven Arts
Seven Arts","Warner Brothers","Peter Yates","Alan R. Trustman","Steve McQueen","Jacqueline Bisset","Robert Vaughn",-122.4033442,37.746826
"Dawn of the Planet of the Apes",2014,"Columbus & Pacific Ave","","Fox Louisiana Productions, LLC","Twentieth Century Fox","Matt Reeves","Rick Jaffa","Gary Oldman","Keri Russell","Andy Serkis",-82.9987942,39.9611755
"Barbary Coast",1935,"","","The Samuel Goldwyn Company","United Artists","Howard Hawks","Ben Hecht","Mariam Hopkins","Edward G. Robinson","Joel McCrea",-122.4194155,37.7749295
"The Maltese Falcon",1941,"Golden Gate Bridge","With 23 miles of ladders and 300,000 rivets in each tower, the Golden Gate Bridge was the world's longest span when it opened in 1937.","Warner Bros. Pictures","Warner Bros. Pictures","John Huston","John Huston","Humphrey Bogart","Mary Astor","Gladys George",-122.4782551,37.8199286
"Getting Even with Dad",1994,"St. Peter & Paul's Church (666 Filbert Street, Washington Square)","Though Marilyn Monroe and Joe DiMaggio were not allowed to be married at the Church (DiMaggio had married his first wife at the Church but was divorced), the couple returned to the steps of the Church for photos, following their City Hall nuptials.","Metro-Goldwyn-Mayer (MGM)","Metro-Goldwyn-Mayer (MGM)","Howard Deutch","Tom S. Parker","Macaulay Culkin","Ted Danson","",-87.8466472,42.6173425
"Freebie and the Bean",1974,"Alco Plaza","","Warner Bros. Pictures","American Broadcasting Company (ABC)","Richard Rush","Robert Kaufman","Alan Arkin","James Caan","Loretta Swit",-122.4194155,37.7749295
"When We Rise",2017,"520 Castro St.","","Film 49 Productions","Amercian Broadcasting Company","Gus Van Sant","Dustin Lance Black","Guy Pierce","Mary-Louise Parker","Michael Kenneth Williams",-122.4351507,37.7604765
"A Taiwanese Tale of Two Cities",2018,"Dolores Park","","Envision Productions Inc.","Netflix","Tien-Lun Yeh","Ling-Hui Chen, Nancy Chen, Chih-Chi Fan, Chia-Hui Lin","Tammy Cheng","Peggy Tseng","Shen-Hao Wen",-122.4269038,37.7596168
"A Night Full of Rain",1978,"Fairmont Hotel (950 Mason Street, Nob Hill)","In 1945 the Fairmont hosted the United Nations Conference on International Organization as delegates arrived to draft a charter for the organization. The U.S. Secretary of State, Edward Stettinius drafted the charter in the hotel's Garden Room.","Liberty Film","Warner Bros. Pictures","Lina Wertmuller","Lina Wertmuller","Candice Bergen","Giancarlo Gianni","",-122.4104443,37.7923897
"Godzilla",2014,"Embarcadero & Washington","","Nautilus Productions, LLC","Warner Bros. Pictures","Gareth Edwards","Max Borenstein","Aaron Taylor-Johnson","Elizabeth Olsen","Bryan Cranston",-122.3976732,37.7992627
"Birdman of Alcatraz",1962,"Pier 43 1/2","","Norma Productions","United Artists","John Frankenheimer","Guy Trosper","Burt Lancaster","Karl Maden","Thelma Ritter",-122.41465,37.80911
"Looking Season 2 ep 203",2015,"Willy's Barber shop, 3227 22nd Street","","Mission Street Productions, LLC","HBO","Andrew Haigh","Michael Lannan","Jonathan Groff","Frankie Alvarez","Murray Bartlett",-122.419437,37.7552116
"Foul Play",1978,"Sacramento & Hyde Streets (Nob Hill)","","Paramount Pictures","Paramount Pictures","Colin Higgins","Colin Higgins","Goldie Hawn","Chevy Chase","Burgess Meredith",-121.4943996,38.5815719
"Always Be My Maybe",2019,"22nd Ave Home","","Isla Productions, LLC","Netflix","Nahnatchka Khan","Michael Golamco, Randall Park, Ali Wong","Ali Wong","Randall Park","Keanu Reeves",-122.4801107,37.759701
"Terminator - Genisys",2015,"Mission St., Embarcadero, and Front between Clay and Market","","T5 Productions LLC","Paramount Pictures","Alan Taylor","James Cameron","Arnold Schwarzenegger","Jason Clarke","",-122.4239421,37.7392503
"Bitter Melon",2018,"68 Dublin St","","Bitter Melon Film LLC/Mammoth Pictures","ABS-CBN, Gravitas Ventures","H.P. Mendoza","H.P. Mendoza","Jon Norman Schneider","Patrick Epino","Brian Rivera",-122.4263685,37.7188413
"Ant-Man",2015,"California between Kearney and Davis","Driving shots","PYM Particles Productions, LLC","Walt Disney Studios Motion Pictures","Peyton Reed","Gabriel Ferrari","Michael Douglas","Paul Rudd","",-122.4194155,37.7749295
"Maxie",1985,"Asian Art Museum (200 Larkin Street, Civic Center)","The Dalai Lama opened an exhibition on Wisdom and Compassion at the museum in 1991.","Elsboy Entertainment","Orion Pictures Corporation","Paul Aaron","Patricia Resnick","Glenn Close","Mandy Patinkin","Ruth Gordon",-122.4165153,37.7799725
"Venom",2018,"Epic Steakhouse, 369 Embarcadero","","L.O.Z. Productions, Inc.","Columbia Pictures, Sony Pictures Releasing","Ruben Fleischer","Jeff Pinkner, Scott Rosenberg","Tom Hardy","Michelle Wiliams","Riz Ahmed",-122.3893566,37.7908379
"Chance- Season 1 ep103",2016,"The Drew School, 2901 California","","TVM Productions","HULU","Michael Lehmann","Kem Nunn","Hugh Laurie","Gretchen Mol","Ethan Suplee",-122.442352,37.787638
"The Last Black Man in San Francisco",2019,"415 Lyon St/355 Lyon St","","LBMISF, LLC","A56","Joe Talbot","Joe Talbot, Jimmie Fails, Rob Richert","Jimmie Fails","Jonathan Majors","Danny Glover",-122.4430856,37.7748794
"Boys and Girls",2000,"Lombard Street","Lombard Street is not actually the most crooked in SF. That honor goes to Potrero Hill's Vermont Street between 22nd and 23rd.","Punch 21 Productions","Dimension Films","Robert Iscove","The Drews","Freddie Prinze, Jr.","Alyson Hannigan","",-122.4267626,37.8009851
"The Woman In Red",1984,"Palace of Fine Arts (3301 Lyon Street)","The original Palace was built for the 1915 Panama-Pacific Exposition, and completely destroyed in 1964. It was rebuilt in 1965.","Orion Pictures Corp.","MGM Home Entertainment","Gene Wilder","Jean Loup Dabadie & Yves Robert","Gene Wilder","Charles Grodin","",-122.4486055,37.8020068
"Knife Fight",2013,"City Hall","","Divisadero Pictures & Knife Fight","Eagle Films","Bill Guttentag","Bill Guttentag & Chris Lehane","Rob Lowe","Julie Bowen","Jamie Chung",-122.4192646,37.7792597
"Vertigo",1958,"Brocklebank Apartments (1000 Mason Street)","","Alfred J. Hitchcock Productions","Paramount Pictures","Alfred Hitchcock","Alec Coppel","James Stewart","Kim Novak","Barbara Bel Geddes",-122.4105791,37.7931691
"Alexander's Ragtime Band",1938,"Cliff House (1090 Point Lobos Avenue)","In 1887, the Cliff House was severely damaged when the schooner Parallel, abandoned and loaded with dynamite, ran aground on the rocks below.","Twentieth Century Fox Film Corporation","Twentieth Century Fox Film Corporation","Henry King","Kathryn Scola","Tyrone Power","Alice Faye","Don Ameche",-122.5139808,37.778507
"The Princess Diaries",2001,"Fisherman's Wharf","Supposedly, Mikhail S. Gorbachev has said that his favorite part of visiting America was touring Fisherman's Wharf.","Walt Disney Pictures","Buena Vista Pictures","Garry Marshall","Gina Wendkos","Julie Andrews","Anne Hathway","",-122.4177434,37.8079996
"Murder in the First, Season 3",2016,"Howard Street at Steuart Street","","Turner North Center Productions","Turner Network Television (TNT)","Steven Bochcho","Eric Lodal","Taye Diggs","Kathleen Robertson","Ian Anthony Dale",-122.3916688,37.7920034
"The OA Part II",2019,"Washington btwn Gough and Octavia St","","Lunar Mining LLC","Netflix","Zal Batmanglij","Zal Batmanglij, Brit Marling","Brit Marling","Emory Cohen","Patrick Gibson",-122.4276133,37.7916146
"180",2011,"Polk & Larkin Streets","","SPI Cinemas","","Jayendra","Umarji Anuradha, Jayendra, Aarthi Sriram, & Suba","Siddarth","Nithya Menon","Priya Anand",-94.7419077,37.5433801
"Chance- Season 1 ep109",2016,"60 Leavenworth St.","","TVM Productions","HULU","Sara Gran and Pete Begler","Dan Attias","Hugh Laurie","Gretchen Mol","Ethan Suplee",-122.4135524,37.7811707
"Fearless",1993,"Kohl Building (400 Montgomery Street)","","Spring Creek Productions","Warner Bros. Pictures","Peter Weir","Rafael Yglesias","Jeff Bridges","Isabella Rosellini","Rosie Perez",-122.4025849,37.7931409
"Smile Again, Jenny Lee",2015,"Mission Inn (5630 Mission St)","","Carlo Caldana/Marguery Films","","Carlo Caldana","Linda Demetrick","Craig Tsuyumine","Puneet Prasad","Larry Kitagawa",-122.4471916,37.7111827
"I Am Michael",2015,"Grove & Polk, thru Fulton & 6th, Masonic, 28th & 47th","","That’s Hollywood","","Justin Kelly","Justin Kelly","James Franco","Emma Roberts","Zachary Quinto",-118.357974,34.0719929
"George of the Jungle",1997,"Neiman Marcus (150 Stockton Street, Union Square)","The City of Paris department store previously occupied the space that now houses Neiman Marcus. City of Paris' original rotunda and glass dome were incorporated into Neiman Marcus' design.","Walt Disney Pictures","Buena Vista Pictures","Sam Weisman","Jay Ward","Brendan Fraser","Leslie Mann","",-122.4060397,37.7870678
"Vertigo",1958,"Claude Lane at Bush Street","","Alfred J. Hitchcock Productions","Paramount Pictures","Alfred Hitchcock","Alec Coppel","James Stewart","Kim Novak","Barbara Bel Geddes",-122.4044317,37.7907167
"Looking",2014,"Treasure Island","","Mission Street Productions, LLC","Home Box Office (HBO)","Andrew Haigh","Michael Lannan","Jonathan Groff","Frankie J. Alvarez","Murray Bartlett",-122.370648,37.8235515
"The Last Black Man in San Francisco",2019,"Mission btwn 16th and Cesar Chavez","","LBMISF, LLC","A29","Joe Talbot","Joe Talbot, Jimmie Fails, Rob Richert","Jimmie Fails","Jonathan Majors","Danny Glover",-122.4151875,37.7549534
"Foul Play",1978,"Golden Gate & Steiner Streets (Hayes Valley)","","Paramount Pictures","Paramount Pictures","Colin Higgins","Colin Higgins","Goldie Hawn","Chevy Chase","Burgess Meredith",-122.4782551,37.8199286
"Birth of the Dragon",2016,"California at Mason","","BOTD U.S. Productions, Inc.","Kylin Pictures","George Nolfi","Christopher Wilkinson, Stephen J. Rivele","Philip Ng","Billy Magnussen","Yu Xia",-122.4108428,37.7918421
"Quitters",2015,"Yerba Buena Gardens","","Frederick & Ashbury, LLC.","","Noah Pritzker","Noah Pritzker","Kara Hayward","Mira Sorvino","Saffron Burrows",-122.4023464,37.7850153
"Terminator - Genisys",2015,"California at Larkin","","T5 Productions LLC","Paramount Pictures","Alan Taylor","James Cameron","Arnold Schwarzenegger","Jason Clarke","",-122.4190635,37.790797
"Panther",1995,"","","Gramercy Pictures","PolyGram Video","Mario Van Peebles","Mario Van Peebles","Kadeem Hardison","Bookeem Woodbine","",-122.4194155,37.7749295
"Foul Play",1978,"City Hall","The dome of SF's City Hall is almost a foot taller than that of the US Capitol Building. In 1954, Joe DiMaggio and Marilyn Monroe married at the Beaux Arts-style building.","Paramount Pictures","Paramount Pictures","Colin Higgins","Colin Higgins","Goldie Hawn","Chevy Chase","Burgess Meredith",-122.4192646,37.7792597
"The Dead Pool",1988,"KGO-TV ABC7 TV Studios (900 Front Street, Waterfront Historic District)","","Warner Bros. Pictures","Warner Bros. Pictures","Buddy Van Horn","Harry Julian Fink","Clint Eastwood","Liam Neeson","Patricia Clarkson",-122.3995554,37.8005786
"Looking",2014,"770 Haight St","","Mission Street Productions, LLC","Home Box Office (HBO)","Andrew Haigh","Michael Lannan","Jonathan Groff","Frankie J. Alvarez","Murray Bartlett",-122.43489,37.771831
"Chance Season 2",2017,"Market St at Embarcadero","","TVM Productions Inc.","Hulu","Rozann Dawson","Alexandra Cunningham","Hugh Laurie","Greta Lee","Ethan Suplee",-122.4214214,37.7733717
"Godzilla",2014,"Bush & Kearny","","Nautilus Productions, LLC","Warner Bros. Pictures","Gareth Edwards","Max Borenstein","Aaron Taylor-Johnson","Elizabeth Olsen","Bryan Cranston",-83.3396372,35.9296915
"Terminator - Genisys",2015,"San Francisco - Oakland Bay Bridge","","T5 Productions LLC","Paramount Pictures","Alan Taylor","James Cameron","Arnold Schwarzenegger","Jason Clarke","",-122.3778182,37.7982799
"Murder in the First, Season 1",2014,"Hall of Justice (850 Bryant Street)","","Turner North Center Productions","Turner Network Television (TNT)","Steven Bochcho","Eric Lodal","Taye Diggs","Kathleen Robertson","Ian Anthony Dale",-122.4040001,37.775146
"Alcatraz",2012,"Broadway from Mason to Taylor","","Bonanza Productions Inc.","Warner Bros. Television","J.J. Abrams","Steven Lilien","Sarah Jones","Jorge Garcia","",-122.4120243,37.7974175
"Sense8 - Season 2",2016,"San Francisco City Hall, 1 Dr. Carlton B. Goodlett Pl.","Many films have shot scene in and around the building including Raiders of the Lost Ark, Invasion of the Body Snatchers, Dirty Harry, The Towering Inferno, A View to a Kill and most recently, Milk. The Christmas party scene for this show was shot in the Rotunda.","Unpronounceable Productions, LLC","Netflix","Wachowski Siblings","J. Michael Straczynski, Wachowiski Siblings","Jamie Clayton","Daryl Hannah","Naveen Andrews",-122.4192646,37.7792597
"Time After Time",1979,"SF General Hospital Center (1001 Potrero Avenue, Potrero Hill)","SF General Hospital is the only Level I Trauma Center serving San Francisco and northern San Mateo County.","Orion Pictures Corp.","Columbia Broadcasting System (CBS)","Nicholas Meyer","Karl Alexander","Malcolm McDowell","Mary Steenburgen","David Warner",-122.4049965,37.7561161
"Chance- Season 1 ep106",2016,"McAllister between Leavenworth and Hyde","","TVM Productions","HULU","Sara Gran","Dan Attias","Hugh Laurie","Gretchen Mol","Ethan Suplee",-122.4155004,37.7809317
"Chan is Missing",1982,"Golden Dragon Restaurant (816 Washington Street at Grant)","","New Yorker Films","New Yorker Films","Wayne Wang","Wayne Wang","Wood Moy","Marc Hayashi","Lauren Chew",-122.4069317,37.7951913
"Pushing Dead",2016,"2930 3rd Street","","Pushing Dead , LLC","TBD","Tom Brown","Tom Brown","Danny Glover","James Roday","Robin Weigert",-122.3879709,37.7519723
"Budding Prospects, Pilot",2017,"Bernal Heights Boulevard","","Picrow Streaming Inc.","Amazon","Terry Zwigoff","Melissa Axelrod, T. C. Boyle (based on the book by)","Adam Rose","Will Sasso","Joel David Moore",-122.412627,37.742249
"Cardinal X",2015,"Lyon at Chestnut St.","","Fire Horse Film Productions LLC","","Annie Wang","Annie Wang","Annie Q","Francesca Eastwood","Pierson Fode",-122.4475098,37.7993888
"180",2011,"City Hall","","SPI Cinemas","","Jayendra","Umarji Anuradha, Jayendra, Aarthi Sriram, & Suba","Siddarth","Nithya Menon","Priya Anand",-122.4192646,37.7792597
"The Last Black Man in San Francisco",2019,"959 South Van Ness Ave","","LBMISF, LLC","A40","Joe Talbot","Joe Talbot, Jimmie Fails, Rob Richert","Jimmie Fails","Jonathan Majors","Danny Glover",-122.4164861,37.7578315
"Woman on the Run",1950,"772 Commercial Street at Kearney","Called ""Man Loh's Oriental Roof Garden"" in the film.","Fidelity Pictures Corporation","Universal Pictures","Norman Foster","Norman Foster","Ann Sheridan","Dennis O'Keefe","Robert Keith",-122.4058703,37.7940098
"Etruscan Smile",2017,"Turk Street between Mason & Leavenworth","","Po Valley Productions, LLC","TBD","Oded Binnun/ Michel Brezis","Sarah Bellwood, Michal Lali Kagan, Michael McGowan Amital Stern, Jose Luis Sampedro","Brian Cox","Roseanne Arquette","Thora Birch",-122.4239413,37.7815527
"The Enforcer",1976,"24th Street Mini Park (Mission District)","","Warner Bros. Pictures","Warner Bros. Pictures","James Fargo","Stirling Silliphant","Clint Eastwood","Tyne Daly","Harry Guardino",-122.4085877,37.7530458
"I Am Michael",2015,"4100 20th St","","That’s Hollywood","","Justin Kelly","Justin Kelly","James Franco","Emma Roberts","Zachary Quinto",-122.43269,37.758031
"Bullitt",1968,"Mansell & University Streets (Visitacion  Valley)","","Warner Brothers / Seven Arts
Seven Arts","Warner Brothers","Peter Yates","Alan R. Trustman","Steve McQueen","Jacqueline Bisset","Robert Vaughn",-84.3211872,34.0382103
"Basic Instinct",1992,"Kearney Street (Telegraph Hill)","","Carolco Pictures","TriStar Pictures","Paul Verhoeven","Joe Eszterhas","Michael Douglas","Sharon Stone","George Dzundza",-122.4062184,37.8016977
"Chance - Season 1 Pilot",2016,"1055 Montgomery St.","","TVM Productions","HULU","Lenny Abrahamson","Alexandra Cunningham and Kem Nunn","Hugh Laurie","Gretchen Mol","Ethan Suplee",-122.4042497,37.7988922
"Final Analysis",1992,"City Hall","The dome of SF's City Hall is almost a foot taller than that of the US Capitol Building. In 1954, Joe DiMaggio and Marilyn Monroe married at the Beaux Arts-style building.","Warner Bros. Pictures","Warner Bros. Pictures","Phil Joanou","Robert Berger","Richard Gere","Kim Basinger","",-122.4192646,37.7792597
"San Andreas",2015,"Vallejo St. Garage, 766 Vallejo St.","Characters watch from roof of garage as tsunami hits SF waterfront","Upside Down Productions, Inc.","Warner Bros.","Brad Peyton","Allan Loeb","Dwayne Johnson","","",-122.4099596,37.7987186
"Chance Season 2",2017,"Lombard St between Leavenworth and Hyde St","","TVM Productions Inc.","Hulu","Rozann Dawson","Alexandra Cunningham","Hugh Laurie","Greta Lee","Ethan Suplee",-122.41874,37.802139
"Always Be My Maybe",2019,"Trax Bar, Haight St","","Isla Productions, LLC","Netflix","Nahnatchka Khan","Michael Golamco, Randall Park, Ali Wong","Ali Wong","Randall Park","Keanu Reeves",-122.4460607,37.7700415
"Looking",2014,"Bay Bridge","","Mission Street Productions, LLC","Home Box Office (HBO)","Andrew Haigh","Michael Lannan","Jonathan Groff","Frankie J. Alvarez","Murray Bartlett",-122.3778182,37.7982799
"Pushing Dead",2016,"Octavia at Grove Street","","Pushing Dead , LLC","TBD","Tom Brown","Tom Brown","Danny Glover","James Roday","Robin Weigert",-122.4248495,37.7776176
"Milk",2008,"Market & Castro Street","From 1910-1920 the Castro was called ""Little Scandinavia"" because of its high concentration of residents of Scandinavian ancestry.","Focus Features","Focus Features","Gus Van Sant","Dustin Lance Black","Sean Penn","Emile Hirsch","",-95.6425911,37.0359275
"Steve Jobs",2015,"Intersection of Columbus and Kearny","","RDF Productions LLC","Universal Pictures","Danny Boyle","Aaron Sorkin","Michael Fassbender","Kate Winslet","Seth Rogen",-122.4053082,37.7969143
"Chance- Season 1 ep102",2016,"John St. between Powell and Mason","","TVM Productions","HULU","Lenny Abrahamson","Alexandra Cunningham","Hugh Laurie","Gretchen Mol","Ethan Suplee",-122.4109304,37.7959474
"The Internship",2013,"Players Arcade at Pier 39","","Twentieth Century Fox Film Corporation","Twentieth Century Fox Film Corporation","Shawn Levy","Vince Vaughn","Vince Vaughn","Owen Wilson","Rose Byrne",-122.410476,37.811104
"Looking",2014,"Church and Duboce Muni Station","","Mission Street Productions, LLC","Home Box Office (HBO)","Andrew Haigh","Michael Lannan","Jonathan Groff","Frankie J. Alvarez","Murray Bartlett",-122.4297042,37.7694834
"Boys and Girls",2000,"1122 Folsom Street","","Punch 21 Productions","Dimension Films","Robert Iscove","The Drews","Freddie Prinze, Jr.","Alyson Hannigan","",-122.4086985,37.7763832
"Beautiful Boy",2018,"Wisconsin between 19th and 20th St","","Big Indie Pictures","Amazon Studios","Felix van Groeningen","Luke Davies","Steve Carell","Timothee Chalamet","Maura Tierney",-122.3991631,37.7592963
"The Right Stuff",1983,"Financial District","","The Ladd Company","The Ladd Company","Philip Kaufman","Philip Kaufman","Sam Shepard","Scott Glenn","Ed Harris",-122.3999445,37.7945742
"Freebie and the Bean",1974,"Hyatt Regency Hotel (5 Embarcadero Center)","","Warner Bros. Pictures","American Broadcasting Company (ABC)","Richard Rush","Robert Kaufman","Alan Arkin","James Caan","Loretta Swit",-122.3956663,37.7942169
"Freebie and the Bean",1974,"Nob Hill","Railroad tycoons like Leland Stanford (founder of Stanford University) lived in Nob Hill at the turn of the 20th Century. The 1906 earthquake completely destroyed Nob Hill, with the exception of the wall that surrounded the mansions of Stanford and his neighbor Mark Hopkins.","Warner Bros. Pictures","American Broadcasting Company (ABC)","Richard Rush","Robert Kaufman","Alan Arkin","James Caan","Loretta Swit",-122.416113,37.793014
"Looking Season 2 ep 203",2015,"Kezar Pavillion","","Mission Street Productions, LLC","HBO","Andrew Haigh","Michael Lannan","Jonathan Groff","Frankie Alvarez","Murray Bartlett",-122.4539336,37.7675483
"Dim Sum: A Little Bit of Heart",1985,"San Francisco International Airport","SFO has a museum dedicated to aviation history.","CIM","Orion Classics","Wayne Wang","Terrel Seltzer","Laureen Chew","Kim Chew","Victor Wong",-122.3789554,37.6213129
